"lat"	"long"	"depict"	"name"	"abstract"
37.9714	23.7262	"http://commons.wikimedia.org/wiki/Special:FilePath/View_of_the_Acropolis_Athens_(pixinn.net).jpg"	"Acropolis of Athens"	"The Acropolis of Athens (Ancient Greek: Ἀκρόπολις; Modern Greek: Ακρόπολη Αθηνών Akrópoli Athinón) is an ancient citadel located on a high rocky outcrop above the city of Athens and contains the remains of several ancient buildings of great architectural and historic significance, the most famous being the Parthenon. The word acropolis comes from the Greek words ἄκρον (akron, ""highest point, extremity"") and πόλις (polis, ""city""). Although there are many other acropoleis in Greece, the significance of the Acropolis of Athens is such that it is commonly known as ""The Acropolis"" without qualification. While there is evidence that the hill was inhabited as far back as the fourth millennium BC, it was Pericles (c. 495 – 429 BC) in the fifth century BC who coordinated the construction of the site's most important buildings including the Parthenon, the Propylaia, the Erechtheion and the Temple of Athena Nike. The Parthenon and the other buildings were seriously damaged during the 1687 siege by the Venetians in the Morean War when the Parthenon was being used for gunpowder storage and was hit by a cannonball. The Acropolis was formally proclaimed as the pre-eminent monument on the European Cultural Heritage list of monuments on 26 March 2007."
20.5524	75.7004	"http://commons.wikimedia.org/wiki/Special:FilePath/Ajanta_(63).jpg"	"Ajanta Caves"	"The Ajanta Caves in Aurangabad district of Maharashtra state of India are about 30 rock-cut Buddhist cave monuments which date from the 2nd century BCE to about 480 or 650 CE. The caves include paintings and sculptures described by the government Archaeological Survey of India as ""the finest surviving examples of Indian art, particularly painting"", which are masterpieces of Buddhist religious art, with figures of the Buddha and depictions of the Jataka tales. The caves were built in two phases starting around the 2nd century BCE, with the second group of caves built around 400–650 CE according to older accounts, or all in a brief period of 460 to 480 according to the recent proposals of Walter M. Spink. The site is a protected monument in the care of the Archaeological Survey of India, and since 1983, the Ajanta Caves have been a UNESCO World Heritage Site. With the Ellora Caves, Ajanta is the major tourist attraction of the Marathwada region of Maharashtra. About 59 kilometres (37 miles) from Jalgaon railway station on the Delhi – Mumbai line and Howrah-Nagpur-Mumbai line of the Central Railway zone, and 104 kilometres (65 miles) from the city of Aurangabad. They are 100 kilometres (62 miles) from the Ellora Caves, which contain Hindu and Jain temples as well as Buddhist caves, the last dating from a period similar to Ajanta. The Ajanta caves are cut into the side of a cliff that is on the south side of a U-shaped gorge on the small river Waghur, and although they are now along and above a modern pathway running across the cliff they were originally reached by individual stairs or ladders from the side of the river 10–35 m (30–110 ft) below. The area was previously heavily forested, and after the site ceased to be used the caves were covered by jungle until accidentally rediscovered in 1819 by a British officer on a hunting party. They are Buddhist monastic buildings, apparently representing a number of distinct ""monasteries"" or colleges. The caves are numbered 1 to 28 according to their place along the path, beginning at the entrance. Several are unfinished and some barely begun and others are small shrines, included in the traditional numbering as e.g. ""9A""; ""Cave 15A"" was still hidden under rubble when the numbering was done. Further round the gorge are a number of waterfalls, which when the river is high are audible from outside the caves. The caves form the largest corpus of early Indian wall-painting; other survivals from the area of modern India are very few, though they are related to 5th-century paintings at Sigiriya in Sri Lanka. The elaborate architectural carving in many caves is also very rare, and the style of the many figure sculptures is highly local, found only at a few nearby contemporary sites, although the Ajanta tradition can be related to the later Hindu Ellora Caves and other sites."
34.3906	47.4358	"http://commons.wikimedia.org/wiki/Special:FilePath/Bisotun_Iran_Relief_Achamenid_Period.JPG"	"Behistun Inscription"	"The Behistun Inscription (also Bisotun, Bistun or Bisutun), (Persian: بیستون, Old Persian: Bagastana, meaning ""the place of god"") is a multi-lingual inscription and large rock relief on a cliff at Mount Behistun in the Kermanshah Province of Iran, near the city of Kermanshah in western Iran. It was crucial to the decipherment of cuneiform script. Authored by Darius the Great sometime between his coronation as king of the Persian Empire in the summer of 522 BC and his death in autumn of 486 BC, the inscription begins with a brief autobiography of Darius, including his ancestry and lineage. Later in the inscription, Darius provides a lengthy sequence of events following the deaths of Cyrus the Great and Cambyses II in which he fought nineteen battles in a period of one year (ending in December 521 BC) to put down multiple rebellions throughout the Persian Empire. The inscription states in detail that the rebellions, which had resulted from the deaths of Cyrus the Great and his son Cambyses II, were orchestrated by several impostors and their co-conspirators in various cities throughout the empire, each of whom falsely proclaimed kinghood during the upheaval following Cyrus's death. Darius the Great proclaimed himself victorious in all battles during the period of upheaval, attributing his success to the ""grace of Ahura Mazda"". The inscription includes three versions of the same text, written in three different cuneiform script languages: Old Persian, Elamite, and Babylonian (a variety of Akkadian). The inscription is to cuneiform what the Rosetta Stone is to Egyptian hieroglyphs: the document most crucial in the decipherment of a previously lost script. The inscription is approximately 15 metres high by 25 metres wide and 100 metres up a limestone cliff from an ancient road connecting the capitals of Babylonia and Media (Babylon and Ecbatana, respectively). The Old Persian text contains 414 lines in five columns; the Elamite text includes 593 lines in eight columns, and the Babylonian text is in 112 lines. The inscription was illustrated by a life-sized bas-relief of Darius I, the Great, holding a bow as a sign of kingship, with his left foot on the chest of a figure lying on his back before him. The supine figure is reputed to be the pretender Gaumata. Darius is attended to the left by two servants, and nine one-meter figures stand to the right, with hands tied and rope around their necks, representing conquered peoples. Faravahar floats above, giving his blessing to the king. One figure appears to have been added after the others were completed, as was Darius's beard, which is a separate block of stone attached with iron pins and lead."
-0.1	36.1	"http://commons.wikimedia.org/wiki/Special:FilePath/Lake-Nakuru.jpg"	"Great Rift Valley"	"The Great Rift Valley is a name given to the continuous geographic trench, approximately 6,000 kilometres (3,700 mi) in length, that runs from Lebanon's Beqaa Valley in Asia to Mozambique in South Eastern Africa. The name continues in some usages, although it is today considered geologically imprecise as it combines features that are today regarded as separate, although related, rift and fault systems. Today, the term is most often used to refer to the valley of the East African Rift, the divergent plate boundary which extends from the Afar Triple Junction southward across eastern Africa, and is in the process of splitting the African Plate into two new separate plates. Geologists generally refer to these incipient plates as the Nubian Plate and the Somali Plate."
45.0492	1.17611	"http://commons.wikimedia.org/wiki/Special:FilePath/Lascaux2.jpg"	"Lascaux"	"Lascaux (Lascaux Caves) (/læsˈkoʊ/, [lasko]) is the setting of a complex of caves in southwestern France famous for its Paleolithic cave paintings. The original caves are located near the village of Montignac, in the department of Dordogne. They contain some of the best-known Upper Paleolithic art. These paintings are estimated to be 17,300 years old. They primarily consist of images of large animals, most of which are known from fossil evidence to have lived in the area at the time. In 1979, Lascaux was added to the UNESCO World Heritage Sites list along with other prehistoric sites in the Vézère valley."
38.9244	-6.34806	"http://commons.wikimedia.org/wiki/Special:FilePath/El_acueducto_de_Los_Milagros.jpg"	"Acueducto de los Milagros"	"The Acueducto de los Milagros (English: Miraculous Aqueduct) is a ruined Roman aqueduct bridge, part of the aqueduct built to supply water to the Roman colony of Emerita Augusta, today Mérida, Spain. Only a relatively small stretch of the aqueduct still stands, consisting of 38 arched pillars standing 25 metres (82 ft) high along a course of some 830 metres (2,720 ft). It is constructed from opus mixtum - granite ashlar blocks interspersed with red brick - utilising a double arcade arrangement. The structure originally brought water to the city from a reservoir called the Lago de Proserpina, fed by a stream called Las Pardillas, around 5 km (3.1 mi) to the north-west of Mérida. It is thought to have been constructed during the 1st century AD, with a second phase of building (or renovations) around 300 AD. In later centuries, the inhabitants of Mérida dubbed it the ""Miraculous Aqueduct"" for the awe that it evoked. The aqueduct was one of three built at Mérida, the other two being the 15 kilometres (9.3 mi) long Aqua Augusta, fed by the Cornalvo reservoir, and San Lázaro, fed by underground channels. The aqueduct is preserved as part of the Archaeological Ensemble of Mérida, a UNESCO World Heritage Site. In the immediate vicinity a small Roman bridge called Puente de Albarregas runs parallel to the arcades."
46.595	9.76	"http://commons.wikimedia.org/wiki/Special:FilePath/GlacierLandwasser.jpg"	"Albula Railway"	"The Albula Railway (German: Albulabahn; Italian: Ferrovia dell'Albula) is a single track metre gauge railway line forming part of the so-called core network of the Rhaetian Railway (RhB), in the Canton of Graubünden, Switzerland. It links Thusis on the Hinterrhein (697 m (2,287 ft) above sea level) with the spa resort of St. Moritz in Engadine (1,774 m (5,820 ft) above sea level). Construction of the Albula Railway was begun in September 1898, the opening took place on 1 July 1903, and the extension to St. Moritz commenced operations on 10 July 1904. With its 55 bridges and 39 tunnels, the 61.67-kilometre long (38.32 mi) line is one of the most spectacular narrow gauge railways in the world. On 7 July 2008, the Albula Railway and the Bernina Railway, which also forms part of the RhB, were jointly recorded in the list of UNESCO World Heritage Sites, under the name Rhaetian Railway in the Albula / Bernina Landscapes. The best known trains operating on the Albula Railway are the Glacier Express and the Bernina Express."
51.984	9.813	"http://commons.wikimedia.org/wiki/Special:FilePath/Fagus_Gropius_Hauptgebaeude_200705_wiki_front.jpg"	"Fagus Factory"	"The Fagus Factory (German: Fagus Fabrik or Fagus Werk), a shoe last factory in Alfeld on the Leine, Lower Saxony, Germany, is an important example of early modern architecture. Commissioned by owner Carl Benscheidt who wanted a radical structure to express the company's break from the past, the factory was designed by Walter Gropius and Adolf Meyer. It was constructed between 1911 and 1913, with additions and interiors completed in 1925."
10.1	-75.2	"http://commons.wikimedia.org/wiki/Special:FilePath/Fiesta_Palenque.jpg"	"San Basilio de Palenque"	"San Basilio de Palenque or Palenque de San Basilio is a Palenque village and corregimiento in the Municipality of Mahates, Bolivar in northern Colombia. In 2005 the village was declared Masterpieces of the Oral and Intangible Heritage of Humanity by UNESCO. Palenque is also considered the first free town in America."
-34.085	-70.3825	"http://commons.wikimedia.org/wiki/Special:FilePath/Sewell.jpg"	"Sewell, Chile"	"Sewell is an uninhabited Chilean mining town located on the slopes of the Andes in the commune of Machalí in Cachapoal Province, Libertador General Bernardo O'Higgins Region, at an altitude of between 2,000 and 2,250 metres."
44.6464	10.9261	"http://commons.wikimedia.org/wiki/Special:FilePath/Modena-Ghirlandina.jpg"	"Torre della Ghirlandina"	"The Torre della Ghirlandina or simply Ghirlandina is the bell tower of the Cathedral of Modena, in Emilia-Romagna, Italy. Standing at 86.12 metres, the tower is the traditional symbol of Modena, being visible from all directions outside the city. The structure was set up in 1179 on five floors, initially called Torre di San Geminiano. To compete with Bologna's towers, the commune added the characteristic octagonal cusp, designed by Arrigo da Campione, one of the numerous masters from Campione who took part in the cathedral's renovation in the 13th-15th centuries. The top of the tower is decorated with two ghirlande (two marble railings), whence the name. In the interior, the Sala della Secchia room (with 15th-century frescoes) is home of a copy of the depiction of the Secchia rapita, a memory of the tower's former role as treasury of the Modenese commune. Also notable are the sculpted capitals in the Sala dei Torresani hall, in the fifth floor.The five bells are tuned in C major, cast during renaissance period."
49.75	21.233	"http://commons.wikimedia.org/wiki/Special:FilePath/Sekowa_drewniany_kosciol.jpg"	"Wooden churches of Southern Lesser Poland"	"Wooden Churches of Southern Lesser Poland and Subcarpathia of the UNESCO inscription are located in Gorlice, Nowy Targ, Bochnia counties (Lesser Poland Voivodeship or Małopolskie), and Brzozów County (Subcarpathian Voivodeship) and are in Binarowa, Blizne, Dębno, Haczów, Lipnica Dolna, and Sękowa. There are in fact many others of the region which fit the description:""The wooden churches of southern Little Poland represent outstanding examples of the different aspects of medieval church-building traditions in Roman Catholic culture. Built using the horizontal log technique, common in eastern and northern Europe since the Middle Ages..."" The wooden church style of the region originated in the late Medieval, the late sixteenth century, and began with Gothic ornament and polychrome detail, but because they were timber construction, the structure, general form, and feeling is entirely different from the gothic architecture or Polish Gothic (in stone or brick). Later construction show Rococo and Baroque ornamental influence. The form of these Roman Catholic churches is deeply influenced by the Greco-Catholic and Orthodox presence in the region. Some display Greek cross plans and onion domes, but the most interesting of the churches combine these features with the Roman forms with elongated naves and steeples. Other collections of wooden churches of the region are in the open-air museums in Sanok and Nowy Sącz."
49.3361	19.5583	"http://commons.wikimedia.org/wiki/Special:FilePath/Hervartov_dreveny_kostelik_Slovakia_3834.JPG"	"Wooden churches of the Slovak Carpathians"	"Carpathian Wooden Churches is the name of a UNESCO World Heritage Site that consists of nine wooden religious buildings constructed between the 16th and 18th centuries in eight different locations in Slovakia. They include two Roman Catholic (Hervartov, Tvrdošín), three Protestant (so-called Articular churches in Hronsek, Leštiny, Kežmarok) and three Greek Catholic churches (Bodružal, Ruská Bystrá, Ladomirová) plus one belfry in Hronsek. In addition to these churches there are about 50 more wooden churches in the territory of present-day Slovakia mainly in the northern and eastern part of the Prešov Region (see e.g. this map). Roman Catholic wooden church of St. Francis of Assisi in Hervartov (see picture above) has a Gothic character as represented by its tall but narrow structure unusual for a wooden church. It was built in the second half of the 15th century and thus represents the oldest of its type in Slovakia. The floor is made of stones again unlike in most of wooden churches where it is usually made of wood. Rare wall paintings were added in 1665 during the reformation period and they depict, among others, Adam and Eve in the Eden or the struggle of St. George with the dragon. The main altar of Virgin Mary, St. Catherine of Alexandria, and St. Barbara was made between 1460 and 1470 and restored in the second half of the 20th century. Roman Catholic Gothic church of All Saints in Tvrdošín was built in the second half of the 15th century and modified in a Renaissance style in the 17th century. Baroque main altar depicting All Saints is from the end of the 17th century. Remaining part of the original Gothic altar with St. Peter and St. John the Baptist ended up in muzeum in Budapest after the World War I. Worth of notice are also ceiling paintings depicting the starry heaven, as well as many religious artefacts from the 17th century. Severe restrictions embodied in the articles of the Congress of Sopron (1681) that enabled building of Protestant, so called articular, churches caused their extraordinary appearance. They must have been built within the single year, without any metal parts such as nails, and without any tower. Thus the construction of the church in Hronsek began on 23 October 1725 and was finished in the autumn of the 1726, the same year when the adjacent belfry was built as well. Church is 8m high and has a shape of the cross with arms 23 and 18m long. As there are many unusual motives from Scandinavian architecture, it is assumed that craftsmen from Norway and/or Sweden participated on the construction site. Unique is also the ordering of the benches on the choirs so that the church can accommodate 1100 worshipers through its 5 doors. The altar has 6 tables from 1771 by Master Samuel Kialovič. Construction of the wooden evangelical articular church in Leštiny in the Orava region of Slovakia was ordered by Jób Zmeškal and finished in 1688. Interior dates back to the 17th and 18th century nad it is whole beautifully painted. Main altar is from the 18th century and the famous Slovak poet Pavol Országh Hviezdoslav was baptised here as well. Built in 1717, church in Kežmarok with one of the most fascinating interiors with exceptional wall paintings as well as wood carvings is considered to be the most beautiful of the last 5 remaining articular churches in Slovakia. In order to raise money for the construction of the church, fund-raising campaigns were conducted in many parts of Europe, e.g. Sweden and Denmark. The architect of the church was Juraj Müttermann from Popradu and with its width of 30.31m, length of 34.68m, and height of 20.60m, it together with 6 side choirs it can serve more than 1500 worshipers, which is quite an achievement for a wooden church. Ceiling paintings started in 1717 and continued for several decades. They depict blue heaven, 12 apostles, 4 evangelists, plus the Holy Trinity above the altar. Ján Lerch from Kežmarok made the altar between 1718 and 1727 with the central motive of the Calvary. Extraordinary masterwork is also the organ built between 1717 and 1720 by Vavrinec Čajkovský, and extended in 1729 by Master Martin Korabinský from Spišská Nová Ves. After general restoration in the 1990s services are again regularly hold there. Greek Catholic church of St. Nicholas in Bodružal built in 1658 consists of three interconnected square-shaped parts along the east-west axis with 3 towers (the biggest one with the bells) topped with little onion domes and iron crosses. Artistically it belongs to folk Baroque style. Church is surrounded with the cemetery, wall, and the belfry from the 19th century. Some of the 18th century wall paintings are still preserved as well as iconostasis, and other icons from the same century. Altar was reconstructed in 1990s and the whole building subsequently in the 2004. Two of the three bells was melted down in the World War I and replaced only in the second half of the 1920s. From 1968 until the middle of the 1990s the church was biritual, i.e. holding Greek Catholic as well as Eastern Orthodox services. nowadays it belongs only to the Greek Catholic Church. Church of St. Nicholas in Ruská Bystrá built at the beginning of the 18th century has just 2 towers and the shape of its almost perfect geometric roof resembles traditional houses of peasants. Interior with religious artefacts dates back to the 18th century as well. Church of Archangel Michael in Ladomirová built in 1742 without a single nail has basically the same design as the one in Bodružal including its surroundings (wall, cemetery, belfry)."
41.8497	123.421	"http://commons.wikimedia.org/wiki/Special:FilePath/Zhaoling_Tomb_of_the_Qing_Dynasty01.jpg"	"Zhao Mausoleum (Qing dynasty)"	"Zhaoling (Chinese: 昭陵; pinyin: Zhàolíng; Lit: Luminous Tomb), also known as Beiling (Northern Tomb) is the mausoleum of the second Qing emperor, Huang Taji, and his empress Xiaoduanwen Borjite. The tomb is located within Beiling Park, in the northern part of Shenyang, in Liaoning province, and is a popular area attraction. The tomb complex took eight years to build (between 1643 and 1651) and has a row of animal statues leading to it. The tomb and surrounding park cover an area of 3,300,000 square metres making it the largest of the three imperial tombs north of the great wall. The area around the tomb was originally set aside for imperial use and ordinary people were forbidden entry. This forbidden area was opened to the public in 1928 and now forms Shenyang's Beiling Park."
49.3	17.3772	"http://commons.wikimedia.org/wiki/Special:FilePath/Arcibiskupský_zámek_Kroměříž_-1.jpg"	"Kroměříž Castle"	"The Kroměříž Castle (Czech: Zámek Kroměříž or Arcibiskupský zámek, German: Schloss Kremsier) in Kroměříž, Czechia, used to be the principal residence of the bishops and (since 1777) archbishops of Olomouc."
40.635	22.9479	"http://commons.wikimedia.org/wiki/Special:FilePath/Church_of_the_Acheiropoietos.JPG"	"Church of the Acheiropoietos"	"The Church of the Acheiropoietos (Greek: [Παναγία] Ἀχειροποίητος) is a 5th-century Byzantine church in the northern Greek city of Thessaloniki. It is located in the city's centre, at Agias Sofias street opposite Makedonomachon square."
50.1333	-5.38333	"http://commons.wikimedia.org/wiki/Special:FilePath/Crowns_peh.jpg"	"Cornwall and West Devon Mining Landscape"	"The Cornwall and West Devon Mining Landscape is a World Heritage Site which includes select mining landscapes in Cornwall and West Devon in the south west of England. The site was added to the World Heritage List during the 30th Session of the UNESCO World Heritage Committee in Vilnius, July 2006. Following plans in 2011 to restart mining at South Crofty, and to build a supermarket at Hayle Harbour, the World Heritage Committee drafted a decision in 2014 to put the site on the List of World Heritage in Danger, but this was rejected at the 38th Committee Session at Doha, Qatar (July 2014), in favour of a follow-up Reactive Monitoring Mission."
16.484	99.524	"http://commons.wikimedia.org/wiki/Special:FilePath/Histparkkamphet.png"	"Kamphaeng Phet Historical Park"	"Kamphaeng Phet Historical Park is an archeological site in Kamphaeng Phet, Thailand. Along with Sukhothai Historical Park and Si Satchanalai historical park, it is a part of the UNESCO World Heritage Site Historic Town of Sukhothai and Associated Historic Towns. Major features in the Kamphaeng Phet Historical Park include archaeological remains of ancient sites such as Mueang Chakangrao to the east of the Ping River, Mueang Nakhon Chum to the west and Mueang Trai Trueng some 18 km from the town to the southwest. Chakangrao, the ancient Kamphaeng Phet town, had the same town planning concept as the old Sukhothai and Si Satchanalai, with separate zones for religious sites both within and outside of town limits. Structures are usually large and made of laterite. Religious sites on the west bank of the Ping River at Nakhon Chum are built of bricks and of smaller size. City walls and old fortifications mark the boundary of the rectangular town area, measuring 300-700 metres wide and 2,200 metres long."
