"lat"	"long"	"depict"	"name"	"abstract"
45.5967	9.53611	"http://commons.wikimedia.org/wiki/Special:FilePath/Crespi_d'Adda_fabbrica.JPG"	"Crespi d'Adda"	"Crespi d'Adda is a historical settlement in Capriate San Gervasio, Lombardy, northern Italy. It is an outstanding example of the 19th and early 20th-century ""company towns"" built in Europe and North America by enlightened industrialists to meet the workers' needs. The site is still intact and is partly used for industrial purposes, although changing economic and social conditions now threaten its survival. Since 1995 it has been on UNESCO's list of World Heritage Sites. In 1869 Cristoforo Benigno Crespi, a textile manufacturer from Busto Arsizio (Varese), bought the 1 km valley between the rivers Brembo and Adda, to the south of Capriate, with the intention of installing a cotton mill on the banks of the Adda. Cristoforo Crespi introduced the most modern spinning, weaving and finishing processes in his Cotton Mill. The Hydroelectric power plant in Trezzo, on the Adda river just a few Km upwards, was built up around 1906 for the manufacturer Cristoforo Benigno Crespi. The settlement which was built in 1878 next to the cotton-mill was a village, a residential area provided with social services such as a clinic, a school building, a theatre, a cemetery, a wash-house and a church. Both the town and the factory were illuminated thanks to electric light. The village of Crespi d'Adda was the first village in Italy to have modern public lighting. The workers houses, of English inspiration, are lined up in order along parallel roads to the East of the factory. A tree-lined avenue separates the production zone from the houses, overlooking a chequer-board road plan.The whole architecture and town planning (except the first spinning department, created by engineer Angelo Colla), was submitted to the architect Ernesto Pirovano. For about fifty years Pirovano, helped by the engineer Pietro Brunati, ran the construction of the village. In 1889 the son of Cristoforo, Silvio, started work in the factory as a director, after spending time in Oldham, England. He turned away from the large multiple-occupancy blocks in favour of the single-family house, with its own garden, which he saw as conducive to harmony and a defence against industrial strife. He put this policy into practice in 1892 and the years that followed, with success, since there was no strike or other form of social disorder for the fifty years of Crespi management. The great depression of 1929 and the harsh fascist fiscal policy resulted in the Crespi family being obliged to sell the entire town to STI, the Italian textile enterprise, which transferred it to the Rossarl e Varzi company in 1970. It then passed to the Legler company, which sold off most of the houses. It was last in the hands of the Polli industrial group, which employed some 600 people, as compared with the 3200 employed during the years of maximum activity. Today the village is inhabited by a community largely descended from the original workers. The factory stopped production only in 2004, its field of activity throughout its working life having been cotton textile production. In October 2013, it was announced that Antonio Percassi was purchasing Crespi d'Adda in order to convert into the headquarters for the Percassi Business group as well as the headquarters for the new Antonio Percassi Family Foundation."
55.2744	20.9708	"http://commons.wikimedia.org/wiki/Special:FilePath/Pilkosios_kopos1.jpg"	"Curonian Spit"	"The Curonian Spit (Lithuanian: Kuršių nerija, Russian: Ку́ршская коса́ (Kurshskaya kosa), German: Kurische Nehrung, Latvian: Kuršu kāpas) is a 98 km long, thin, curved sand-dune spit that separates the Curonian Lagoon from the Baltic Sea coast. Its southern portion lies within Kaliningrad Oblast, Russia and its northern within southwestern Lithuania. It is a UNESCO World Heritage Site shared by the two countries."
38.0131	23.6358	"http://commons.wikimedia.org/wiki/Special:FilePath/Gotic_Dafni.jpg"	"Daphni Monastery"	"Daphni or Dafni (Greek: Δαφνί; Katharevousa Δαφνίον, Daphnion) is an 11th-century Byzantine monastery 11 km north-west of central Athens in the suburb of Chaidari, south of Athinon Avenue (GR-8A). It is situated near the forest of the same name, on the Sacred Way that led to Eleusis. The forest covers about 15 to 20 km². The Daphni Monastery was founded about the turn of the 6th century, Christianizing the site of the Sanctuary of Apollo Daphnaios that had been desecrated by the Goths in 395, and reusing the Ionic columns of the ancient temple of Apollo in its portico; only one remains, the others having been removed to London by Thomas Bruce, 7th Earl of Elgin. The principal church (katholikon), a fine monument of the 11th-century Byzantine art, is a cross-in-square church of the octagonal type surmounted by a broad and high dome. The church houses the best preserved complex of mosaics from the early Komnenian period (ca. 1100) when an austere and hieratic manner typical for the Macedonian period and represented by the famous Christ Pantocrator image inside the dome, was metamorphosing into a more intimate and delicate style, of which The Angel before St Joachim — with its pastoral backdrop, harmonious gestures and pensive lyricism — is considered a superb example. According to the Encyclopaedia Britannica, ""the ensemble represents a visualization of the Christian cosmos, its effect created by an intricately conceived interplay of pictures and architecture. Space in fact fuses the decoration into one giant image, in which the ruler, hailed by the prophets surrounding him, presides in his sphere above the host of saints that people the lower part of the room"". After the church was sacked by the Crusaders in 1205, Otho de la Roche, Duke of Athens, gave it to the Cistercian Abbey of Bellevaux. The French monks had the exonarthex reconstructed, built a wall around the monastery and effected numerous other changes until the Ottomans expelled them and returned the monastery to an Orthodox community in 1458. Gradually, the impoverished cloister fell into disrepair. The monastery was disbanded by Ottoman authorities in 1821 on the outbreak of the Greek War of Independence, but restoration work did not commence until 1888. It was declared a World Heritage Site in 1990. Heavily damaged by the 1999 Athens earthquake, Daphni Monastery is currently closed to the public for restoration."
27.045	88.2672	"http://commons.wikimedia.org/wiki/Special:FilePath/DHR_780_on_Batasia_Loop_05-02-21_08.jpeg"	"Darjeeling Himalayan Railway"	"The Darjeeling Himalayan Railway, also known as the ""Toy Train"", is a 2 ft (610 mm) narrow gauge railway that runs between New Jalpaiguri and Darjeeling in the Indian state of West Bengal, India. Built between 1879 and 1881, the railway is about 78 kilometres (48 mi) long. Its elevation level varies from about 100 metres (328 ft) at New Jalpaiguri to about 2,200 metres (7,218 ft) at Darjeeling. Four modern diesel locomotives handle most of the scheduled services; however the daily Kurseong-Darjeeling return service and the daily tourist trains from Darjeeling to Ghum (India's highest railway station) are handled by the vintage British-built B Class steam locomotives. The railway, along with the Nilgiri Mountain Railway and the Kalka-Shimla Railway, is listed as the Mountain Railways of India World Heritage Site. The headquarters of the railway is in the town of Kurseong. Operations between Siliguri and Kurseong were temporarily suspended since 2010 following a Landslide at Pagla Jhora and another near Tindharia in 2011. However normal Toy Train service has resumed between New Jalpaiguri (NJP) and Darjeeling from 2nd December 2015."
24.7333	46.5756	"http://commons.wikimedia.org/wiki/Special:FilePath/Diriyahpic.jpg"	"Diriyah"	"Diriyah (Arabic: الدرعية), formerly romanized as Dereyeh and Dariyya, is a town in Saudi Arabia located on the north-western outskirts of the Saudi capital, Riyadh. Diriyah was the original home of the Saudi royal family, and served as the capital of the Emirate of Diriyah under the first Saudi dynasty from 1744 to 1818. Today, the town is the seat of the Diriyah Governorate, which also includes the villages of Uyayna, Jubayla, and Al-Ammariyyah, among others, and is part of Ar Riyad Province. The Turaif district in Diriyah was declared a UNESCO World Heritage Site in 2010."
54.7749	-1.57558	"http://commons.wikimedia.org/wiki/Special:FilePath/Yard2.jpg"	"Durham Castle"	"Durham Castle is a Norman castle in the city of Durham, England, which has been wholly occupied since 1840 by University College, Durham. It is open to the general public to visit, but only through guided tours, since it is in use as a working building and is home to over 100 students. The castle stands on top of a hill above the River Wear on Durham's peninsula, opposite Durham Cathedral (grid reference NZ274423)."
18.9583	72.9306	"http://commons.wikimedia.org/wiki/Special:FilePath/Elephanta_Caves_Trimurti.jpg"	"Elephanta Caves"	"The Elephanta Caves (natively known as Gharapurichi Leni, basically Gharapuri) are a network of sculpted caves located on Elephanta Island, or Gharapuri (literally ""the city of caves"") in Mumbai Harbour, 10 kilometres (6.2 mi) to the east of the city of Mumbai in the Indian state of Maharashtra. The island, located on an arm of the Arabian Sea, consists of two groups of caves—the first is a large group of five Hindu caves, the second, a smaller group of two Buddhist caves. The Hindu caves contain rock cut stone sculptures, representing the Shaiva Hindu sect, dedicated to the Lord Shiva. The rock cut architecture of the caves has been dated to between the 5th and 8th centuries, although the identity of the original builders is still a subject of debate. The caves are hewn from solid basalt rock. All the caves were also originally painted in the past, but now only traces remain The main cave (Cave 1, or the Great Cave) was a Hindu place of worship until Portuguese rule began in 1534, after which the caves suffered severe damage. This cave was renovated in the 1970s after years of neglect, and was designated a UNESCO World Heritage Site in 1987 to preserve the artwork. It is currently maintained by the Archaeological Survey of India (ASI)."
20.0264	75.1792	"http://commons.wikimedia.org/wiki/Special:FilePath/Kailasha_temple_at_ellora.JPG"	"Ellora Caves"	"Ellora (e-ˈlȯr-ə, Vērūḷ) is an archaeological site 29 km (18 mi) north-west of the city of Aurangabad in the Indian state of Maharashtra, built by the Rashtrakuta dynasty(Brahmanical & Buddhist group of caves ) and Yadav (Jain group of caves). It is also known as Elapura in the Rashtrakuta Kannada literature. Well known for its monumental caves, Ellora is an UNESCO World Heritage Site and forms one of major tourist attraction in Marathwada region of Maharashtra Ellora represents the epitome of Indian rock-cut architecture. The 34 ""caves"" are actually structures excavated out of the vertical face of the Charanandri hills. Hindu, Buddhist and Jain rock-cut temples and viharas and mathas were built between the 5th century and 10th century. The 17 Hindu (caves 13–29), 12 Buddhist (caves 1–12) and 5 Jain (caves 30–34) caves, built in proximity, demonstrate the religious harmony prevalent during this period of Indian history. It is a protected monument under the Archaeological Survey of India."
27.091	77.661	"http://commons.wikimedia.org/wiki/Special:FilePath/General_Plan_of_Fatehpur_Sikri_City_India_1917.jpg"	"Fatehpur Sikri"	"Fatehpur Sikri (Hindi: फ़तेहपुर सीकरी, Urdu: فتحپور سیکری) is a city in the Agra District of Uttar Pradesh, India. Previously the city's name was Vijaypur Sikari, of the Sikarwar Rajput clan; the later city was founded in 1569 by the Emperor Akbar, and served as the capital of the Mughal Empire from 1571 to 1585. After his military victories over Chittor and Ranthambore, Akbar decided to shift his capital from Agra to a new location 23 miles (37 km) W.S.W on the Sikri ridge, to honour the Sufi saint Salim Chishti. Here he commenced the construction of a planned walled city, which took the next fifteen years in planning, and construction of a series of royal palaces, harem, courts, a mosque, private quarters and other utility buildings. He named the city Fatehabad, with Fateh, a word of Arabic origin in Persian, meaning ""victorious."" It was later called Fatehpur Sikri. It is at Fatehpur Sikri that the legends of Akbar and his famed courtiers, the nine jewels or Navaratnas, were born. Fatehpur Sikri is one of the best preserved collections of Indian Mughal architecture in India. According to contemporary historians, Akbar took a great interest in the building of Fatehpur Sikri and probably also dictated its architectural style. Seeking to revive the splendours of Persian court ceremony made famous by his ancestor Timur, Akbar planned the complex on Persian principles. But the influences of his adopted land came through in the typically Indian embellishments. The easy availability of sandstone in the neighbouring areas of Fatehpur Sikri also meant that all the buildings here were made of the red stone. The Imperial Palace complex consists of a number of independent pavilions arranged in formal geometry on a piece of level ground, a pattern derived from Arab and central Asian tent encampments. In its entirety, the monuments at Fatehpur Sikri thus reflect the genius of Akbar in assimilating diverse regional architectural influences within a holistic style that was uniquely his own. The Imperial complex was abandoned in 1585, shortly after its completion, due to the exhaustion of the small, spring-fed lake that supplied the city with water, and its proximity with the Rajputana areas in the North-West, which were increasingly in turmoil. Thus the capital was shifted to Lahore so that Akbar could have a base in the less stable part of the empire, before moving back to Agra in 1598, where he had begun his reign as he shifted his focus to Deccan. In fact, he never returned to the city except for a brief period in 1601. In later Mughal history it was occupied for a short while by Mughal emperor, Muhammad Shah(r. 1719 -1748) and his regent, Sayyid Hussain Ali Khan Barha, one of the Syed Brothers, was murdered here in 1720. The palaces were occupied by the Marathas after their conquest of Delhi, then transferred to the British army, which used the fortified complex as a headquarters and barracks. Restoration began under Lord Curzon. Because the palace area has been in nearly continuous use over the centuries, much of the imperial complex which spread over nearly two mile long and one mile wide area is largely intact. It is still surrounded by a five mile long wall built during its original construction on three sides. However apart from the imperial buildings complex and the magnificent mosque, which continues in use, little of the city survives. The former site of the city is mostly barren, except of ruins of the bazaars of the old city near the Naubat Khana, the 'drum-house' entrance at Agra Road. The modern town lies at the western end of the complex, which was a municipality from 1865 to 1904, and later made a notified area and in 1901 had a population of 7,147. For a long time it was still known for its masons and stone carvers, though in Akbar time it was known and 'fabrics of hair' and 'silk-spinning'. The village of Sikri still exists nearby."
-4.06274	39.6796	"http://commons.wikimedia.org/wiki/Special:FilePath/Fort_JesusMombasa.jpg"	"Fort Jesus"	"Fort Jesus (Portuguese: Forte Jesus de Mombaça) is a Portuguese fort built between 1593 and 1596 by order of King Philip I of Portugal, located on Mombasa Island to guard the Old Port of Mombasa, Kenya. It was built in the shape of a man (viewed from the air), and was given the name of Jesus. In 2011, the fort was declared a World Heritage Site by UNESCO, highlighted as one of the most outstanding and well preserved examples of 16th-century Portuguese military fortifications."
35.6797	51.4203	"http://commons.wikimedia.org/wiki/Special:FilePath/Golestan_palace_Tehran.jpg"	"Golestan Palace"	"The Golestan Palace (Persian: کاخ گلستان - Kāx e Golestān), literally the Roseland Palace, is the former royal Qajar complex in Iran's capital city, Tehran. The oldest of the historic monuments in Tehran, and of world heritage status, the Golestan Palace belongs to a group of royal buildings that were once enclosed within the mud-thatched walls of Tehran’s Historic Arg (citadel)."
35.8	128.1	"http://commons.wikimedia.org/wiki/Special:FilePath/Korea-Haeinsa-07.jpg"	"Haeinsa"	"Haeinsa (해인사, 海印寺: Temple of the Ocean Mudra) is a head temple of the Jogye Order (대한불교조계종, 大韓佛敎 曹溪宗) of Korean Buddhism in the Gaya Mountains (가야산, 伽倻山), South Gyeongsang Province South Korea. Haeinsa is most notable for being the home of the Tripitaka Koreana, the whole of the Buddhist Scriptures carved onto 81,350 wooden printing blocks, which it has housed since 1398. Haeinsa is one of the Three Jewel Temples of Korea, and represents Dharma or the Buddha’s teachings. It is still an active Seon (선, 禪) practice center in modern times, and was the home temple of the influential Rev. Seongcheol (성철, 性徹), who died in 1993."
30.0036	117.982	"http://commons.wikimedia.org/wiki/Special:FilePath/Nanhu_Lake.jpg"	"Hongcun"	"Hongcun (Chinese: 宏村; pinyin: Hóngcūn, ""Hong village"") is a village in Yi County in the historical Huizhou region of southern Anhui Province, China, near the southwest slope of Mount Huangshan. The village is arranged in the shape of an ox with the nearby hill (Leigang Hill) interpreted as the head, and two trees standing on it as the horns. Four bridges across the Jiyin stream can be seen as the legs whilst the houses of the village form the body. Inside the “body”, the Jiyin stream represents the intestines and various lakes such as the “South Lake” (Nanhu) form the other internal organs. The architecture and carvings of the approximately 150 residences dating back to the Ming and Qing Dynasties are said to be among the best of their kind in China.[citation needed] One of the biggest of the residences open to visitors, Chenzhi Hall, also contains a small museum. Together with Xidi, the village became a UNESCO World Heritage Site in 2000. Scenes from the film Crouching Tiger, Hidden Dragon were filmed on location in Hongcun."
52.6266	-2.48	"http://commons.wikimedia.org/wiki/Special:FilePath/Ironbridge002.JPG"	"Ironbridge Gorge"	"The Ironbridge Gorge is a deep gorge formed by the River Severn in Shropshire, England. Originally called the Severn Gorge, the gorge now takes its name from its famous Iron Bridge, the first iron bridge of its kind in the world, and a monument to the industry that began there. The bridge was built in 1779 to link the industrial town of Broseley with the smaller mining town of Madeley and the growing industrial centre of Coalbrookdale. There are two reasons the site was so useful to the early industrialists. The raw materials, coal, iron ore, limestone and clay, for the manufacture of iron, tiles and porcelain are exposed or easily mined in the gorge. The deep and wide river allowed easy transport of products to the sea."
34.2958	132.32	"http://commons.wikimedia.org/wiki/Special:FilePath/Itsukushima_Gate.jpg"	"Itsukushima Shrine"	"Itsukushima Shrine (Japanese: 厳島神社 Itsukushima-jinja) is a Shinto shrine on the island of Itsukushima (popularly known as Miyajima), best known for its ""floating"" torii gate. It is in the city of Hatsukaichi in Hiroshima Prefecture in Japan. The shrine complex is listed as a UNESCO World Heritage Site, and the Japanese government has designated several buildings and possessions as National Treasures."
-2.17028	-62.6172	"http://commons.wikimedia.org/wiki/Special:FilePath/NEO_lake_jau_big.jpg"	"Jaú National Park"	"The Jau national park (""Parque Nacional do Jaú"" in Portuguese) is located in the Amazonas state in Brazil, between 1º00’—3º00’S and 61º30’—64º00’W. It is the largest forest reserve in South America, covering an area greater than 5.6 million acres (23,000 km²). Entry into the park is restricted; express permission from the Brazilian government is required to enter the reserve. The park is known as a good example of tropical rainforest conservation in the Amazon. It houses Jaguars, Amazonian Manatees, Amazon river dolphins, and numerous other species of animals and plants."
55.7558	9.41944	"http://commons.wikimedia.org/wiki/Special:FilePath/Runesten_i_Jelling.jpg"	"Jelling stones"	"The Jelling stones are massive carved runestones from the 10th century, found at the town of Jelling in Denmark. The older of the two Jelling stones was raised by King Gorm the Old in memory of his wife Thyra. The larger of the two stones was raised by King Gorm's son, Harald Bluetooth in memory of his parents, celebrating his conquest of Denmark and Norway, and his conversion of the Danes to Christianity. The runic inscriptions on these stones are considered the best known in Denmark."
50.7056	-2.98989	"http://commons.wikimedia.org/wiki/Special:FilePath/Jurassic_Coast_west_of_St_Aldhelm's_Head.JPG"	"Jurassic Coast"	"The Jurassic Coast is a World Heritage Site on the English Channel coast of southern England. It stretches from Orcombe Point near Exmouth in East Devon to Old Harry Rocks near Swanage in East Dorset, a distance of 96 miles (155 kilometres). Chartered in 2001, the Jurassic coast was the second wholly natural World Heritage Site to be designated in the United Kingdom. Its entire length can be walked on the South West Coast Path. The site was featured on the television programme Seven Natural Wonders as one of the wonders of the South West (of the UK), and in a 2005 poll of Radio Times readers, the Jurassic Coast was named as the fifth-greatest natural wonder in Britain."
51.4226	-1.8478	"http://commons.wikimedia.org/wiki/Special:FilePath/Avebury,_West_Kennet_Avenue,_Wiltshire,_UK_-_Diliff.jpg"	"Kennet Avenue"	"Kennet Avenue or West Kennet Avenue is a prehistoric site in the English county of Wiltshire. It was an avenue of two parallel lines of stones 25m wide and 2.5 km in length which ran between the Neolithic sites of Avebury and The Sanctuary. A second avenue, called Beckhampton Avenue led west from Avebury towards Beckhampton Long Barrow. Excavations by Stuart Piggott and Alexander Keiller in the 1930s indicated that around 100 pairs of standing stones had lined the avenue and that they dated to around 2200 BC based on finds of Beaker burials found beneath some of the stones. Many stones have since fallen or are missing however. Keiller and Piggott righted some of the fallen stones they excavated as did Maud Cunnington during her earlier work there. More recently the stones have been the subject of vandalism when red paint was thrown over some of them. It is part of the Avebury World Heritage Site. West Kennet Avenue is in the freehold ownership of The National Trust and in English Heritage guardianship. It is managed by The National Trust on behalf of English Heritage, and the two organisations share the cost of managing and maintaining the property."
51.8825	4.63333	"http://commons.wikimedia.org/wiki/Special:FilePath/Kinderdijkwindmolen3.JPG"	"Kinderdijk"	"Kinderdijk is a village in the Netherlands, belonging to the municipality of Molenwaard, in the province South Holland, about 15 km east of Rotterdam. Kinderdijk is situated in a polder in the Alblasserwaard at the confluence of the Lek and Noord rivers. To drain the polder, a system of 19 windmills was built around 1740. This group of mills is the largest concentration of old windmills in the Netherlands. The windmills of Kinderdijk are one of the best-known Dutch tourist sites. They have been a UNESCO World Heritage Site since 1997."
51.8825	4.64944	"http://commons.wikimedia.org/wiki/Special:FilePath/Kinderdijkwindmolen3.JPG"	"Kinderdijk"	"Kinderdijk is a village in the Netherlands, belonging to the municipality of Molenwaard, in the province South Holland, about 15 km east of Rotterdam. Kinderdijk is situated in a polder in the Alblasserwaard at the confluence of the Lek and Noord rivers. To drain the polder, a system of 19 windmills was built around 1740. This group of mills is the largest concentration of old windmills in the Netherlands. The windmills of Kinderdijk are one of the best-known Dutch tourist sites. They have been a UNESCO World Heritage Site since 1997."
51.8833	4.63333	"http://commons.wikimedia.org/wiki/Special:FilePath/Kinderdijkwindmolen3.JPG"	"Kinderdijk"	"Kinderdijk is a village in the Netherlands, belonging to the municipality of Molenwaard, in the province South Holland, about 15 km east of Rotterdam. Kinderdijk is situated in a polder in the Alblasserwaard at the confluence of the Lek and Noord rivers. To drain the polder, a system of 19 windmills was built around 1740. This group of mills is the largest concentration of old windmills in the Netherlands. The windmills of Kinderdijk are one of the best-known Dutch tourist sites. They have been a UNESCO World Heritage Site since 1997."
