"lat"	"long"	"depict"	"name"	"abstract"
53.0759	8.80731	"http://commons.wikimedia.org/wiki/Special:FilePath/RolandBremen01.jpg"	"Bremen Roland"	"The Bremen Roland is a statue of Roland, erected in 1404. It stands in the market square (Rathausplatz) of Bremen, Germany, facing the cathedral, and shows Roland, paladin of the first Holy Roman Emperor Charlemagne and hero of the Battle of Roncevaux Pass. Roland is shown as protector of the city: his legendary sword (known in chivalric legend as Durendal) is unsheathed, and his shield is emblazoned with the two-headed Imperial eagle. The standing figure is 5.47 m tall, and stands on a 60 cm rostrum. A supporting column, crowned by a baldachin, brings the combined height to 10.21 m. The statue was carved in limestone from Elm, and was commissioned by the city fathers to replace a wooden one burnt in 1366 by Prince-Archbishop Albert II. It confronts the church as a representation of city rights opposed to the territorial claims of the prince-archbishop. Statues of Roland appear in numerous cities of the former Holy Roman Empire, as emblems of city liberties, Stadtrechte. The Roland statue at Bremen is the oldest surviving example. From Bremen the symbol of civic liberty and freedom spread to other cities and has become a symbol of the new Europe. Since 1973, it is protected by the monument protection act. In July 2004, along with the town hall, the statue was added to the list of UNESCO World Heritage Sites."
35.6186	116.986	"http://commons.wikimedia.org/wiki/Special:FilePath/Confuciustombqufu.jpg"	"Cemetery of Confucius"	"The Cemetery of Confucius, also known under its Chinese name Kong Lin (Chinese: 孔林; pinyin: Kǒng Lín; literally: ""Kongs' Forest""), is a cemetery of the Kong clan (the descendants of Confucius) in Confucius' hometown Qufu in Shandong province. Confucius himself and some of his disciples are buried there, as well as many thousands of his descendants. Since 1994, the Cemetery of Confucius has been part of the UNESCO World Heritage Site ""Temple and Cemetery of Confucius and the Kong Family Mansion in Qufu"". The two other components of the site are the Temple of Confucius dedicated to the memory of the philosopher and the Kong Family Mansion, where his descendants lived. The three sites are collectively known in Qufu as San Kong (三孔), i.e. ""The Three Confucian [sites]""."
-20.4119	164.566	"http://commons.wikimedia.org/wiki/Special:FilePath/Lagoons_and_Reefs_of_New_Caledonia_May_10,_2001.jpg"	"New Caledonia Barrier Reef"	"The New Caledonia Barrier Reef is located in New Caledonia in the South Pacific, and is the second-longest double-barrier coral reef in the world, after the Belize Barrier Reef. The New Caledonia Barrier reef surrounds Grande Terre, New Caledonia's largest island, as well as the Ile des Pins and several smaller islands, reaching a length of 1,500 kilometres (930 mi). The reef encloses a lagoon of 24,000 square kilometres (9,300 sq mi), which has an average depth of 25 meters (82 ft). The reefs lie up to 30 kilometres (19 mi) from the shore, but extend almost 200 kilometres (120 mi) to the Entrecasteaux reefs in the northwest. This northwestern extension encloses the Belep Islands and other sand cays. Several natural passages open out to the ocean. The Boulari passage, which leads to Noumea, the capital and chief port of New Caledonia, is marked by the Amédée lighthouse. The reef has great species diversity with a high level of endemism, and is home to endangered dugongs (Dugong dugon), and is an important nesting site for green sea turtle (Chelonia mydas). Most of the reefs are generally thought to be in good health. Some of the eastern reefs have been damaged by effluent from nickel mining on Grand Terre. Sedimentation from mining, agriculture, and grazing has affected reefs near river mouths, which has been worsened by the destruction of mangrove forests, which help to retain sediment. Some reefs have been buried under several metres of silt. In the lagoons of New Caledonia there are many water species ranging from plankton to larger fish and even sharks. In January 2002, the French government proposed listing New Caledonia's reefs as a UNESCO World Heritage Site. UNESCO listed New Caledonia Barrier Reef on the World Heritage List under the name The Lagoons of New Caledonia: Reef Diversity and Associated Ecosystems on 7 July 2008.The Lagoons were listed under three UNESCO categories:"
46.6292	10.4478	"http://commons.wikimedia.org/wiki/Special:FilePath/Benediktinerkloster_St._Johann.JPG"	"Saint John Abbey, Müstair"	"The Abbey of Saint John (German: Benediktinerinnenkloster St. Johann,Romansh: Claustra benedictina da Son Jon) is an ancient Benedictine monastery in the Swiss village of Müstair, in the Canton of Graubünden. By reason of its exceptionally well-preserved heritage of Carolingian art, it has been a UNESCO World Heritage Site since 1983."
4.6155	-74.069	"http://commons.wikimedia.org/wiki/Special:FilePath/Proseción_Semana_Santa_en_Popayán..jpg"	"Holy Week in Popayán"	"The Holy Week in Popayán, Cauca (Colombia), is the celebration of the Passion and death of Jesus Christ through daily processions continuously performed since the sixteenth century between Good Friday nights and Holy Saturday. This parade takes place in the ancient streets of the ""White City"". Religious images of Spanish, Andalusian, Quito, Italian and Payanes arranged on a wooden platform with 4 front and 4 back ""barrotes"" (bars) are carried in the shoulders of the ""Cargueros"". These images are representations of different episodes recounted in the Gospels on the Passion, Crucifixion and Death of Jesus Christ. Each performance is a ""paso"" (step). The steps are taken through the streets, a distance of a cross-shaped layout since the time of the Conquest, passing by the main churches and temples of the city. On September 30, 2009 it was declared a Masterpieces of the Oral and Intangible Heritage of Humanity by the UNESCO committee."
43.7731	11.2561	"http://commons.wikimedia.org/wiki/Special:FilePath/Firenze_2004_10.JPG"	"Historic Centre of Florence"	"The historic centre of Florence is part of quartiere 1 of the Italian city of Florence. This quarter was named a World Heritage Site by UNESCO in 1982. Built on the site of an Etruscan settlement, Florence, the symbol of the Renaissance, rose to economic and cultural pre-eminence under the Medici in the 15th and 16th centuries. Its 600 years of extraordinary artistic activity can be seen above all in the 13th-century cathedral (Santa Maria del Fiore), the Church of Santa Croce, the Uffizi and the Pitti Palace, the work of great masters such as Giotto, Brunelleschi, Botticelli and Michelangelo."
46.5	8.03333	"http://commons.wikimedia.org/wiki/Special:FilePath/Finsteraarhorn_and_surrounding_mounts.jpg"	"Jungfrau-Aletsch protected area"	"The Jungfrau-Aletsch protected area (officially Swiss Alps Jungfrau-Aletsch) is located in south-western Switzerland between the cantons of Berne and Valais. It is a mountainous region in the easternmost side of the Bernese Alps, containing the northern wall of Jungfrau and Eiger, and the largest glaciated area in western Eurasia, comprising the Aletsch Glacier. The Jungfrau-Aletsch protected area is the first World Natural Heritage site in the Alps, it was inscribed in 2001."
22.9989	57.5361	"http://commons.wikimedia.org/wiki/Special:FilePath/FalajDaris.JPG"	"Aflaj Irrigation Systems of Oman"	"The Aflaj Irrigation Systems of Oman are ancient water channels from 500 AD located in the regions of Dakhiliya, Sharqiya and Batinah. However, they represent a type of irrigation system as old as 5000 years in the region. ""Aflaj"" is the plural of ""Falaj"", which means ""split into parts"" in classical Arabic. This irrigation system effectively divided the water among all the inhabitants; it flowed by gravity from the sources to homes and cropland. The complex included watchtowers to protect it, but also mosques and other buildings. In 2006, five Aflaj Irrigation Systems of Oman were added to the UNESCO list of World Heritage Sites: Falaj Al-Khatmeen, Falaj Al-Malki, Falaj Daris, Falaj Al-Mayassar and Falaj Al-Jeela"
20.03	-75.3914	"http://commons.wikimedia.org/wiki/Special:FilePath/Cuba_Cafetal_Isabelica_P1080153a.jpg"	"Archaeological Landscape of the First Coffee Plantations in the South-East of Cuba"	"The Archaeological Landscape of the First Coffee Plantations in the South-East of Cuba are the remains of 19th-century coffee plantations located in the foothills of the Sierra Maestra. During the 19th and early 20th centuries, eastern Cuba was primarily involved with coffea cultivation. The remnants of the plantations display the techniques used in the difficult terrain, as well as the economic and social significance of the plantation system in Cuba and the Caribbean. In 2000, the Archaeological Landscape of the First Coffee Plantations in the South-East of Cuba was added to the UNESCO list of World Heritage Sites."
23.27	56.745	"http://commons.wikimedia.org/wiki/Special:FilePath/World_Heritage_Grave_Al_Ayn_Oman.JPG"	"Archaeological Sites of Bat, Al-Khutm and Al-Ayn"	"The Archaeological Sites of Bat, Al-Khutm and Al-Ayn are an important group of necropolis from the 3rd Millennium BC, located near a palm grove. They were declared World Heritage by UNESCO in 1988."
12.5933	-12.8458	"http://commons.wikimedia.org/wiki/Special:FilePath/BedikVillage.jpg"	"Bassari Country"	"The Bassari Country and its Bassari, Fula and Bedik Cultural Landscapes, located in the southeast of Senegal, is a well-preserved multicultural landscape which emerged from the interaction of human activities and the natural environment. It aggregates three geographical areas: the Bassari–Salémata area, the Bedik–Bandafassi area and the Fula–Dindéfello area, each one with its specifics morphological characteristics. In 2012, the Bassari Country with its Bassari, Fula and Bedik Cultural Landscapes was added to the UNESCO list of World Heritage Sites."
15.5024	73.9117	"http://commons.wikimedia.org/wiki/Special:FilePath/Se_cathedral_goa.jpg"	"Churches and convents of Goa"	"Churches and convents of Old Goa refers to the name given by the UNESCO to a set of religious monuments located in Goa Velha (or Old Goa), in the state of Goa, India, and which have been declared a World Heritage Site in 1986. Goa was the ancient capital of Portuguese India and Asia and an evangelization center from the sixteenth century. The justifications for the inclusion of religious monuments in Goa in the World Heritage List are: 1) the influence of the monuments in the dissemination of Western art forms - the Manueline styles, Mannerist and Baroque - throughout Asia where Catholic missions were established; 2) the value of the set of monuments of Goa as an exceptional example that illustrates the work of evangelization and 3) the specific value of presence in the Basilica of Bom Jesus of the tomb of Francisco Xavier, which illustrates a major world event: the influence of the Catholic religion in Asia in the modern era."
37.9109	40.2273	"http://commons.wikimedia.org/wiki/Special:FilePath/Diyarbakir_walls.JPG"	"Diyarbakır Fortress"	"Diyarbakır Fortress, is a historical fortress in Sur, Diyarbakır, Turkey. It consists of inner fortress and outer fortress. Main gates of the fortress are; Dağ (Mountain) Gate, Urfa Gate, Mardin Gate and Yeni (New) Gate. It was built approximately 9000 years ago and has the second most wide and long security walls after Great Wall of China. The UNESCO added the building to their tentative list on 2000, and listed it as a world heritage in 2015 along with Hevsel Gardens."
37.9109	40.2273	"http://commons.wikimedia.org/wiki/Special:FilePath/Tigris_River_At_Diyarbakir.JPG"	"Hevsel Gardens"	"Hevsel Gardens, are the seven hundred hectares fertile lands near Tigris shore, between the Diyarbakır Fortress and the river. The gardens added to UNESCO tentative list in 2013. It became a World Heritage Site in 2015, along with Diyarbakır Fortress."
55.9136	12.3578	"http://commons.wikimedia.org/wiki/Special:FilePath/Jægersborg_Dyrehave_-_Hermitage_Pavilion_and_deer.jpg"	"Par force hunting landscape in North Zealand"	"The Par force hunting landscape in North Zealand is a collection of hunting grounds and forests north of Copenhagen, inscribed on the UNESCO List of World Heritage Sites on 4 July 2015. The landscape comprises three main areas: Store Dyrehave, Gribskov and Jægersborg Dyrehave/Jægersborg Hegn. The landscape was submitted for admission on 1 August 2010."
59.8786	8.59361	"http://commons.wikimedia.org/wiki/Special:FilePath/Furnace_House_A_Notodden.jpg"	"Rjukan–Notodden Industrial Heritage Site"	"Rjukan–Notodden Industrial Heritage Site is a World Heritage Site in Telemark county, Norway, created to protect the industrial landscape around Lake Heddalsvatnet. The landscape is centered on the plant built by the Norsk Hydro to produce fertilizer from atmospheric nitrogen. The complex also includes hydroelectric power plants, transport systems, including railways, transmission lines and factories, and workers' accommodation and social institutions in the towns of Notodden and Rjukan. The site was placed on the tentative World Heritage list on 19 June 2009 together with the Odda–Tyssedal Industrial Heritage Site. On 5 July 2015 it was placed on the World Heritage list, under Criteria II and IV, with following description of the Outstanding Universal Value:"
29.3281	-98.46	"http://commons.wikimedia.org/wiki/Special:FilePath/Mission_Espada_Chapel1.JPG"	"San Antonio Missions (World Heritage Site)"	"The San Antonio Missions are a World Heritage Site located in and near San Antonio, Texas, United States. The World Heritage Site consists of five mission sites, a historic ranch, and related properties. The missions and ranch are: The San Antonio Missions were inscribed on the World Heritage List in 2015."
37.4297	21.9003	"http://commons.wikimedia.org/wiki/Special:FilePath/Temple_apollon_vasses2_OLC.jpg"	"Bassae"	"Bassae (Latin: Bassae, Ancient Greek: Βάσσαι - Bassai, meaning ""little vale in the rocks"") is an archaeological site in Oichalia, a municipality in the northeastern part of Messenia, Greece. In classical antiquity, it was part of Arcadia. Bassae lies near the village of Skliros, northeast of Figaleia, south of Andritsaina and west of Megalopolis. It is famous for the well-preserved mid- to late-5th century BC Temple of Apollo Epicurius. Although this temple is geographically remote from major polities of ancient Greece, it is one of the most studied ancient Greek temples because of its multitude of unusual features. Bassae was the first Greek site to be inscribed on the World Heritage List (1986). Its construction is placed between 450 BC and 400 BC."
53.6928	-6.44932	"http://commons.wikimedia.org/wiki/Special:FilePath/Newgrange.JPG"	"Brú na Bóinne"	"Brú na Bóinne ([ˈbˠɾˠuː n̪ˠə ˈbˠoːn̪ʲə], Palace of the Boyne) is a World Heritage Site in County Meath, Ireland and is the largest and one of the most important complex of Megalithic sites in Europe, dating to the Neolithic period. The complex is situated around a wide bend in the River Boyne."
44.15	3.25	"http://commons.wikimedia.org/wiki/Special:FilePath/Causse_Mejean,_Cevennes_National_Park,_France.jpg"	"Causses"	"The Causses are a group of limestone plateaus (700–1,200 m) in the Massif Central. They are bordered to the north-west by the Limousin and the Périgord uplands, and to the east by the Aubrac and the Cévennes. Large river gorges cut through the plateau, such as the Tarn, Dourbie, Jonte, Lot and Aveyron. Causse is an Occitan word meaning ""limestone plateau"". Arranged from the north-west to the south-east, the following plateaus are found: Many sites on the Causses are included in Natura 2000, notably the Parc Naturel Régional des Grands Causses on the Larzac, Méjean, and Noir plateaus. The Causses and the Cévennes, Mediterranean agro-pastoral Cultural Landscape was added to the UNESCO World Heritage list in 2011."
4.0	-56.5	"http://commons.wikimedia.org/wiki/Special:FilePath/Amazon_jungle_from_above.jpg"	"Central Suriname Nature Reserve"	"The Central Suriname Nature Reserve (Dutch: Centraal Suriname Natuurreservaat (CSNR)) was created in 1998 by Conservation International and the government of Suriname from the fusion of three existing nature reserves: Ralleighvallen, Tafelberg and Eilerts de Haan gebergte. It was designated a UNESCO World Heritage Site in 2000 for its pristine tropical rainforest ecosystem, and contains 16,000 square kilometres (6,178 sq mi) of both montane and lowland primary tropical forest including sections of the Guyana Highlands. It is known for its rapids and bird species, including the Guiana Cock of the Rock (Rupicola rupicola). A research station is located at the foot of Voltzberg and the area is tourist attraction. Some of the most outstanding features in Central Suriname Nature Reserve are several granite domes - uplifted monoliths of granite rising high above the surrounding rainforest. Barren surface of dark-colored granite is exposed to impact of Sun thus creating unique xerophytic biotope which includes also endemic plant species. The best known granite dome is the 245 m high Voltzberg. Other attractions include the Julianatop (1230 m), the highest mountain in Suriname, the Tafelberg (Table Mountain, 1026 meters), the Van Stockum Berg (360 m), Duivelsei (Devil's Egg), a rock seemingly balanced on the edge of a mountain.[citation needed] Eilerts de Haan Nature Park is named for Johannes Gijsbert Willem Jacobus Eilerts de Haan, an explorer who died in Suriname's interior."
36.4353	48.7967	"http://commons.wikimedia.org/wiki/Special:FilePath/Soltaniyeh_interiors.jpg"	"Dome of Soltaniyeh"	"The central magnet of Soltaniyeh's several ruins is the Mausoleum of Il-khan Öljeitü also known as Muhammad Khodabandeh, traditionally known as the Dome of Soltaniyeh in Soltaniyeh city, Zanjan Province. The structure, erected from 1302 to 1312 AD, has the oldest double-shell dome in Iran. This erroneous view of the construction was made by Dieulafoy but is totally disputed by Andre Godard. In Godard's view it is a normal, if spectacularly large dome, with a thin skin on top for the faience and is in no way a double dome. Its importance in the Muslim world may be compared to that of Brunelleschi's cupola for Christian architecture. It is one of the largest brick domes in the world, just at the theoretical engineering limit for a brick dome and the third largest dome in the world after the domes of Florence Cathedral and Hagia Sophia. The Dome of Soltaniyeh paved the way for more daring Iranian-style cupola constructions in the Muslim world, such as the Mausoleum of Khoja Ahmed Yasavi and the Taj Mahal. Much of its exterior decoration has been lost, but the interior retains superb mosaics, faience, and murals.People have described the architecture of the building as “anticipating the Taj Mahal.” The estimated 200 ton dome stands 49 meters (161 ft) tall from its base, and is currently undergoing extensive renovation."
59.9667	16.0083	"http://commons.wikimedia.org/wiki/Special:FilePath/Engelsberg-Huettenwerk-01.jpg"	"Engelsberg Ironworks"	"Engelsberg Ironworks (Swedish: Engelsbergs bruk) is an ironworks in Ängelsberg, a village in Fagersta Municipality in Västmanland, Sweden. It was built in 1681 by Per Larsson Gyllenhöök (1645-1706) and developed into one of the world's most modern ironworks in the period 1700-1800. It is listed as a UNESCO world heritage site since 1993."
-20.2083	-69.7944	"http://commons.wikimedia.org/wiki/Special:FilePath/Humberstone.jpg"	"Humberstone and Santa Laura Saltpeter Works"	"Humberstone and Santa Laura Saltpeter Works are two former saltpeter refineries located in northern Chile. They were declared a UNESCO World Heritage Site in 2005."
31.326	120.625	"http://commons.wikimedia.org/wiki/Special:FilePath/Suzhou_Zhuozheng_Yuan_2015.04.23_08-13-49.jpg"	"Humble Administrator's Garden"	"The Humble Administrator's Garden (simplified Chinese: 拙政园; traditional Chinese: 拙政園; pinyin: Zhuōzhèng Yuán) is a renowned Chinese garden in Suzhou. The garden is located at n°178 Dongbei Street (东北街178号). At 51,950 m2, it is the largest garden in Suzhou and is considered by some to be the finest garden in all of southern China. In 1997, Zhuozheng Yuan, along with other classical gardens of Suzhou was proclaimed a UNESCO World Heritage Site."
-15.0367	40.7328	"http://commons.wikimedia.org/wiki/Special:FilePath/Fort_Sao_Sebastiao.gif"	"Island of Mozambique"	"The Island of Mozambique (Portuguese: Ilha de Moçambique) lies off northern Mozambique, between the Mozambique Channel and Mossuril Bay, and is part of Nampula Province. Prior to 1898, it was the capital of colonial Portuguese East Africa. With its rich history and sandy beaches, the Island of Mozambique is a UNESCO World Heritage site and one of Mozambique's fastest growing tourist destinations. It has a permanent population of approximately 14,000 people and is served by nearby Lumbo Airport on the Nampula mainland."
50.067	19.96	"http://commons.wikimedia.org/wiki/Special:FilePath/Krakau_Markt.jpg"	"Kraków Old Town"	"Kraków Old Town is the historic central district of Kraków, Poland. It is one of the most famous old districts in Poland today and was the center of Poland's political life from 1038 until King Sigismund III Vasa relocated his court to Warsaw in 1596. The entire medieval old town is among the first sites chosen for the UNESCO's original World Heritage List, inscribed as Cracow's Historic Centre. The old town is also one of Poland's official national Historic Monuments (Pomnik historii) chosen in the first round, as designated September 16, 1994, and tracked by the National Heritage Board of Poland. The Old Town is known in Polish as Stare Miasto. It is part of the city's first administrative district which is also named ""Stare Miasto,"" although it covers a wider area than the Old Town itself. Medieval Kraków was surrounded by a 1.9 mile (3 km) defensive wall complete with 46 towers and seven main entrances leading through them. The fortifications around the Old Town were erected over the course of two centuries. The current architectural plan of Stare Miasto – the 13th-century merchants' town – was drawn up in 1257 after the destruction of the city during the Tatar invasions of 1241 followed by raids of 1259 and repelled in 1287. The district features the centrally located Rynek Główny, or Main Square, the largest medieval town square of any European city. There is a number of historic landmarks in its vicinity, such as St. Mary's Basilica (Kościół Mariacki), Church of St. Wojciech (St. Adalbert's), Church of St. Barbara, as well as other national treasures. At the center of the plaza, surrounded by kamienice (row houses) and noble residences, stands the Renaissance cloth hall Sukiennice (currently housing gift shops, restaurants and merchant stalls) with the National Gallery of Art upstairs. It is flanked by the Town Hall Tower (Wieża ratuszowa). The whole district is bisected by the Royal Road, the coronation route traversed by the Kings of Poland. The Route begins at St. Florian's Church outside the northern flank of the old city walls in the medieval suburb of Kleparz; passes the Barbican of Kraków (Barbakan) built in 1499, and enters Stare Miasto through the Florian Gate. It leads down Floriańska Street through the Main Square, and up Grodzka to Wawel, the former seat of Polish royalty overlooking the Vistula river. In the 19th century most of the Old Town fortifications were demolished. The moat encircling the walls was filled in and turned into a green belt known as Planty Park."
22.6568	89.7964	"http://commons.wikimedia.org/wiki/Special:FilePath/Shat-Gambuj-Mashjid.jpg"	"Mosque City of Bagerhat"	"The Mosque City of Bagerhat (Bengali: মসজিদের শহর বাগেরহাট) is a formerly lost city, located in the suburbs of Bagerhat city in Bagerhat District, in the Khulna Division of southwest of Bangladesh. Bagerhat is about 15 miles south east of Khulna and 200 miles southwest of Dhaka. Originally known as Khalifatabad and nicknamed the ""mint town of the Bengal Sultanate"", the city was founded in the 15th century by the warrior saint Turkish general Ulugh Khan Jahan. The historic city, listed by Forbes as one of the 15 lost cities of the world, has more than 50 Islamic monuments which have been found after removing the vegetation that had obscured them from view for many centuries. The site has been recognized as a UNESCO World Heritage Site in 1983 under criteria (iv), ""as an outstanding example of an architectural ensemble which illustrates a significant stage in human history"", of which the Sixty Pillar Mosque (Shat Gombuj Masjid in Bengali), constructed with 60 pillars and 77 domes, is the most well known. Apart from these monuments, UNESCO also includes the mausoleum of Khan Jahan, the mosques of Singar, Bibi Begni, Reza Khoda, Zindavir among the unique monuments."
53.2229	26.6917	"http://commons.wikimedia.org/wiki/Special:FilePath/Нясвіж_і_Нясвіжскі_замак_12.jpg"	"Nesvizh Castle"	"Nesvizh Castle or Niasvizh Castle (Belarusian: Нясвіжскі замак, Niasvižski zamak, Polish: zamek w Nieświeżu, Russian: Несвижский замок, Nesvizhskiy zamok) is a residential castle of the Radziwiłł family in Nesvizh, Belarus. It is situated at an elevation of 183 meters. From 1921 to 1939 the complex was located in Poland and was considered one of the most beautiful Polish castles in the Kresy region."
